Room / Location / Component,Item Name,Comment,Price,OriginalFlag,Include
Interior,Paint Interior Full Interior Paint (Scheme B),"Paint interior of house to ZG color scheme B to include ceilings and garage in flat # 75 Polar Bear Matte, Walls eggshell N320-1 Campfire Ash, Doors, trim and base # 75 Polar Bear semi gloss",0,0,Y
Interior,Paint Interior Full Interior Paint (Scheme B),"Stain Grade Base & Doors - Paint interior of house to ZG color scheme B to include ceilings and garage in flat #75 Polar Bear Matte, Walls eggshell N320-1 Campfire Ash, Doors, trim and base #75 Polar Bear semi gloss. Additional sanding and prep included for stained doors and baseboards.",0,0,Y
Bedroom,Paint Interior Full Room Paint & Drywall (RBR),Full paint and drywall touch ups corner to corner including ceiling.  paint to main house colors,0,0,Y
Kitchen,Paint Interior Full Room Paint & Drywall (RBR),Full paint and drywall touch ups corner to corner including ceiling.  paint to main house colors,0,0,Y
Bedroom,Paint Interior High Ceilings - Clear Story,Additional funds for high ceilings (clear story) 16 ft or greater,0,0,Y
Kitchen,Paint Interior High Ceilings - Clear Story,Additional funds for high ceilings (clear story) 16 ft or greater,0,0,Y
Bedroom,Paint Interior Touch-up Minor Scuffs and Dents,"Paint Wall Corner to Corner, includes minor drywall touch ups as to not show through painted finished wall.",0,0,Y
Kitchen,Paint Interior Touch-up Minor Scuffs and Dents,"Paint Wall Corner to Corner, includes minor drywall touch ups as to not show through painted finished wall.",0,0,Y
Bedroom,Paint Interior Wainscoting,Paint wainscoting. Includes additional prep and costs associated with painting wainscoting a contrasting color. Priced per room.,0,0,Y
Kitchen,Paint Interior Wainscoting,Paint wainscoting. Includes additional prep and costs associated with painting wainscoting a contrasting color. Priced per room.,0,0,Y
Bedroom,Paint Wall Touch up paint,Paint touch ups of spots with matching paint color of wall. walls may flash and that is ok with this level of service,0,0,Y
Kitchen,Paint Wall Touch up paint,Paint touch ups of spots with matching paint color of wall. walls may flash and that is ok with this level of service,0,0,Y
Bedroom,Paint Whole House Clean Scuffs & Marks (no paint),Room by Room cleaning of scuff marks and hand prints with magic eraser and cleaner to get walls back to clean look.,0,0,Y
Kitchen,Paint Whole House Clean Scuffs & Marks (no paint),Room by Room cleaning of scuff marks and hand prints with magic eraser and cleaner to get walls back to clean look.,0,0,Y
Bedroom,Plumbing - Cleanout Cap - Replace,Replace damaged/missing clean out cap,0,0,Y
Kitchen,Plumbing - Cleanout Cap - Replace,Replace damaged/missing clean out cap,0,0,Y
Plumbing,Plumbing - Cleanout Cap - Replace,Replace damaged/missing clean out cap.,0,0,Y
Plumbing,Plumbing - Gas Line - Cap Supply Line,Cap gas supply line.,0,0,Y
Plumbing,Plumbing - Poly B - Line Replacement,"Replace poly b piping with proper pex or copper piping as accessible. will require permit, patch back drywall and holes needed to convert to new plumbing pipes.",0,0,Y
Plumbing,Plumbing - Poly B - Replacement,"Replace poly b piping with proper pex or copper piping as accessible. will require permit, patch back drywall and holes needed to convert to new plumbing pipes.",0,0,Y
Bathroom / Kitchen,Plumbing - Sinks / Tub - Repair Surface Chips,Buff and clean counter top.,0,1,Y
Bathroom / Kitchen,Plumbing - Sinks / Tub - Repair Surface Chips,Plumbing - Repair Chips at sink and tubs.,0,1,Y
Plumbing,Plumbing - Sump Pump - Install High Water Alarm,Install high water alarm.,0,0,Y
Plumbing,Plumbing - Water Heater - Install Sediment Trap,Install sediment trap inline with water heater per new code.,0,0,Y
Plumbing,Plumbing - Water Heater - Replace Supply Line & Valve (Leaking),,0,0,Y
Plumbing,Plumbing - Water Heater - Replace Water Heater Pan & Drain Line,Replace damaged or missing water heater pan. make sure connect drain line to not leak in to house.,0,0,Y
Plumbing,Plumbing - Water Heater Gas Flue Add/ Replace Gas Flue Collar,"Water Heater Gas Flue pipe needs to have colar on top at ceiling. flue pipe needs to maintain 1"" gap on all side of flue.",0,0,Y
Plumbing,Plumbing - Water Heater Install Expansion Tank,Install new water heater expansion tank.,0,0,Y
Plumbing,Plumbing - Water Heater Install T&P Line,Plumbing - Install new TP line at water heater.,0,0,Y
Plumbing,Plumbing - Water Heater Replace Water Heater (Electric),,0,0,Y
Plumbing,Plumbing - Water Heater Replace Water Heater (Gas),,0,0,Y
Plumbing,Plumbing - Water Lines - Replace Water Main Shutoff Valve,Replace main shut off with 1/4 turn ball valve.,0,0,Y
Plumbing,Plumbing - Water Lines Install Pressure Vacuum Breaker / Backflow,Install or replace pressure vacuum breaker.,0,0,Y
Exterior / Plumbing,Plumbing - Water Lines - Replace Hose Bibb,Install insulated hose bibb covers as needed to prevent freezing. ,5,1,Y
Exterior / Plumbing,Plumbing - Water Lines - Replace Hose Bibb,Secure loose hose bibb and seal as needed. ,30,1,Y
Exterior / Plumbing,Plumbing - Water Lines - Replace Hose Bibb,Replace bad hose bibb with new one.,0,1,Y
Exterior / Plumbing,Plumbing - Water Lines - Replace Hose Bibb,Install missing handle at hose bibb.,0,1,Y
Kitchen / Bathroom,Plumbing - Water Lines - Replace Angle Stops,Replace sink sprayer.,0,1,Y
Exterior,Plumbing - Water Lines - Replace Water Main Shutoff Valve,Replace main shut off with 1/4 turn ball valve.,0,1,Y
Plumbing / Exterior,Plumbing - Water Lines - Replace/ Add PRV at Main Line,Replace / Add pressure reducing valve at main line.,0,1,Y
Exterior,Plumbing Cleanout Cap - Replace,Replace damaged/missing clean out cap,0,0,Y
Exterior,Plumbing- Gas Line - Cap Supply Line,Cap gas supply line,0,0,Y
Plumbing,Plumbing Water Heater Drain and Reinstall,Drain and disconnect water heater to have work done in that area. re-connect and fill tank and check for leaks and operational.,0,0,Y
Exterior,Plumbing- Water Lines - Install Vacuum Breaker (irrigation),Install vacuum breaker at water hose bib,0,0,Y
Fencing,Repair Block/Concrete (minor),Concrete repairs on block fence $40per lnft  minor repairs.,0,0,Y
Bedroom,Replace - Electrical- Outlet/ Switch,Replace switch/outlet with similar color and style (Deco/Toggle),0,0,Y
Kitchen,Replace - Electrical- Outlet/ Switch,Replace switch/outlet with similar color and style (Deco/Toggle),0,0,Y
Roof,Roof Flashing - Repair,Roofing repair flashing issues.,0,0,Y
Gutters,Roof Gutters - Install Elbow,Install gutter downspout elbow.,0,0,Y
Gutters,Roof Gutters Add / Replace Splash Block,Install new splash block under gutter downspout.,0,0,Y
Gutters,Roof Gutters Clean Out,Clean out gutters and make sure down spouts and splash pads are clear of debris as well.,0,0,Y
Gutters,Roof Gutters Repair / Replace Sections,Replace damaged or missing gutter with new.,0,0,Y
Exterior,Siding Gable Vent,Siding - Replace Gable Vent.,0,0,Y
Exterior,Siding General Pressure Wash,Thorough and professional cleaning of exterior siding (1story),0,0,Y
Exterior,Siding General Repair Holes & Cracks,Patch holes in siding with Rock Hard patch. Sand and paint,0,0,Y
Exterior,Siding Panel - Replace Panel Siding Walls,Replace siding that is damaged with new like matching siding,0,0,Y
Exterior,"Siding Panel - Replace Water Damaged End (8"" up)","Replace up to 12"" up from bottom damaged siding with like materials",0,0,Y
Exterior,Siding Stone/ Brick Install Stone Veneer,Replace individual stone / brick veneer siding pieces.,0,0,Y
Exterior,Siding Stucco Repair Damage & Touch Up Paint,Repair large holes and touch up paint,0,0,Y
Exterior,Siding Trim,"Trim - Replace 2 x 10 garage wrap - includes demo of existing, installation of new 2 x 10 and vinyl garage door trim, and paint  (per Door).",0,0,Y
Exterior,Siding Trim - Replace Exterior Trim,"Replace exterior door, window and / or siding trim. To include demo, install, materials, caulk and paint to match.",0,0,Y
Exterior,Siding -Vinyl/ Metal- Replace Vinyl Siding,Individual Pieces - Replace damaged siding with new vinyl siding to match existing as close as possible.,0,0,Y
Exterior,Siding -Vinyl/ Metal- Replace Vinyl Siding,Projects Under 100 sqft - Replace damaged siding with new vinyl siding to match existing as close as possible (price per sqft).,0,0,Y
Exterior,Siding Wood/ Hardie - Replace Wood /Hardie Siding,Individual Pieces - Replace damaged siding with new wood / Hardie siding to match existing as close as possible.,0,0,Y
Exterior,Siding Wood/ Hardie - Replace Wood /Hardie Siding,Projects Over 100 sqft -  Replace damaged siding with new wood / Hardie siding to match existing as close as possible (price per sqft).,0,0,Y
Exterior,Siding Wood/ Hardie - Replace Wood /Hardie Siding,Projects Under 100 sqft -  Replace damaged siding with new wood / Hardie siding to match existing as close as possible (price per sqft).,0,0,Y
Exterior,Stairs Handrail Repair,Repair stair handrail that is coming off. add new wall anchors and re-connect bracket to insure safe usage.,0,0,Y
Kitchen,Trim - Baseboard - Replace,Install Pre-Primed Base Molding to Match Existing Molding. per lnft.,0,0,Y
Exterior,Trim - Bird Boards - Replace,Replace bird board with new and caulk in and paint to match,0,0,Y
Roof,Trim - Fascia Replace,Replace fascia board with new and caulk and paint to match.,0,0,Y
Exterior,Trim - Fascia Replace Clips & Caulk Joints,Replace fascia clips and caulk tight and paint to match,0,0,Y
Bedroom,Trim Baseboard Replace,Install Pre-Primed Base Molding to Match Existing Molding. per lnft.,0,0,Y
Roof,Trim Bird Boards - Replace,Replace bird board with new and caulk in and paint to match.,0,0,Y
Roof,Trim Eave/Soffit Repairs,Soffit with Wood Repair / Rebuild damaged soffit/eave with matching materials and style. Style is flat soffit with vertical fascia. Price is per 12 foot of length.,0,0,Y
Exterior,Trim Fascia - Replace,Replace fascia board with new and caulk and paint to match,0,0,Y
Roof,"Trim Fascia - Replace 1""x3"" Fascia Trim",Replace 1x3 trim fascia with new and paint and caulk to match.,0,0,Y
Roof,Trim Fascia - Replace Clips & Caulk Joints,Replace fascia clips and caulk tight and paint to match.,0,0,Y
Exterior,"Trim Fascia Replace 1""x3"" Fascia Trim",Replace 1x3 trim fascia with new and paint and caulk to match,0,0,Y
Bedroom,Trim Shoe Mold,Trim - install missing shoe mold per LnFt,0,0,Y
Kitchen,Trim Shoe Mold,Trim - install missing shoe mold per LnFt,0,0,Y
Bedroom,Windows - Balancers Replace,replace balancers in single Hung windows to make window operate properly,0,0,Y
Kitchen,Windows - Balancers Replace,replace balancers in single Hung windows to make window operate properly,0,0,Y
Bedroom,Windows - Complete Window Unit - Replace,replace new window unit to match existing windows as close as possible to color and style,0,0,Y
Kitchen,Windows - Complete Window Unit - Replace,replace new window unit to match existing windows as close as possible to color and style,0,0,Y
Exterior,Windows - Complete Window Unit Replace,replace new window unit to match existing windows as close as possible to color and style,0,0,Y
Bedroom,Windows - Interior - Casing and Trim,"replace interior window casing / trim. replace all casing per window to include existing sides, top and under sill",0,0,Y
Kitchen,Windows - Interior - Casing and Trim,"replace interior window casing / trim. replace all casing per window to include existing sides, top and under sill",0,0,Y
Bedroom,Windows - Lock (Latch) - Repair,Windows - Repair latching Lock with matching existing style and color,0,0,Y
Kitchen,Windows - Lock (Latch) - Repair,Windows - Repair latching Lock with matching existing style and color,0,0,Y
Bedroom / Bathroom / Kitchen,Windows - Panes (Individual) - Replace,Replace window pane that has a broken thermoseal with a new unit to match existing style and color.,0,1,Y
Bedroom,Windows - Panes (Individual) - Replace,Replace broken window pane with new unit to match existing style and color,0,0,Y
Kitchen,Windows - Panes (Individual) - Replace,Replace broken window pane with new unit to match existing style and color,0,0,Y
Exterior,Windows - Screen - Repair,replace missing or damaged window screen to match existing color and style,0,0,Y
Bedroom,Windows - Screen - Repair,replace missing or damaged window screen to match existing color and style,0,0,Y
Kitchen,Windows - Screen - Repair,replace missing or damaged window screen to match existing color and style,0,0,Y
Exterior,Windows - Screen - Replace,Windows - Screen Replace with new screen and repair rails as needed,0,0,Y
Exterior,Windows - Shutters - Paint,Paint touch up of existing shutters to match existing colors.,0,0,Y
Exterior,Windows - Shutters - Replace,Replace shutters missing or damaged with new matching existing and paint to match colors,0,0,Y
Exterior,Windows - Sliding Door Replace Screen,Replace screen at sliding glass door - pick matching color.,0,0,Y
Bedroom,Windows - Sliding Glass Door - Replace,Replace damaged Sliding Glass Door with new one,0,0,Y
Kitchen,Windows - Sliding Glass Door - Replace,Replace damaged Sliding Glass Door with new one,0,0,Y
Bedroom,Windows - Sliding Glass Door - Replace Glass Only,Replace broken glass at sliding glass door 6' tall,0,0,Y
Kitchen,Windows - Sliding Glass Door - Replace Glass Only,Replace broken glass at sliding glass door 6' tall,0,0,Y
Bedroom,Windows - Sliding Glass Door Repair,"Repair sliding glass door to roll, lock and seal properly.",0,0,Y
Kitchen,Windows - Sliding Glass Door Repair,"Repair sliding glass door to roll, lock and seal properly.",0,0,Y
Exterior,Windows - Tint Remove,Remove window tint on glass. use water solution as to not scratch the windows. make sure all material and glue is removed and glass is clean,0,0,Y
Bedroom,Windows Blinds - Add New/ Replace,"Replace blinds with 2"" faux wood blinds. color to match existing if not existing default is white.",0,0,Y
Kitchen,Windows Blinds - Add New/ Replace,"Replace blinds with 2"" faux wood blinds. color to match existing if not existing default is white.",0,0,Y
Bedroom,Windows Blinds- Repair,Windows - Repair window blinds and make sure that they are fucntional,0,0,Y
Kitchen,Windows Blinds- Repair,Windows - Repair window blinds and make sure that they are fucntional,0,0,Y
Exterior,Windows- Panes (Individual) - Replace,Replace broken window pane with new unit to match existing style and color,0,0,Y
Bedroom,Windows Screen- Replace,Windows - Screen Replace with new screen and repair rails as needed,0,0,Y
Kitchen,Windows Screen- Replace,Windows - Screen Replace with new screen and repair rails as needed,0,0,Y
Exterior,Windows Shutters - Secure/ Re-attach,Replace shutters missing or damaged with new matching existing and paint to match colors,0,0,Y
Bedroom,Windows Sliding Door Replace Screen,Replace screen at sliding glass door - pick matching color.,0,0,Y
Kitchen,Windows Sliding Door Replace Screen,Replace screen at sliding glass door - pick matching color.,0,0,Y
Exterior,Windows Sliding Glass Door - Repair,"Repair sliding glass door to roll, lock and seal properly.",0,0,Y
Exterior,Windows Sliding Glass Door - Replace Glass Only,Replace broken glass at sliding glass door 6' tall,0,0,Y
Exterior,Windows- Sliding Glass Door Replace,Replace damaged Sliding Glass Door with new one,0,0,Y
Bedroom,Windows Tint Remove,Remove window tint on glass. use water solution as to not scratch the windows. make sure all material and glue is removed and glass is clean,0,0,Y
Kitchen,Windows Tint Remove,Remove window tint on glass. use water solution as to not scratch the windows. make sure all material and glue is removed and glass is clean,0,0,Y
Bedroom,Windows Track Rollers - Repair & Adjust,Repair window rollers and adjust window to close and lock properly,0,0,Y
Kitchen,Windows Track Rollers - Repair & Adjust,Repair window rollers and adjust window to close and lock properly,0,0,Y
Bathroom,Plumbing - Toilets - Replace,"Replace toilet with new one. Includes wax ring, check flange and nuts and level toilet in place.",0,1,Y
Bathroom,Plumbing - Toilets - Secure Toilet,Secure toilet that is loose / out of level with plastic wedge and caulk to floor.,0,1,Y
Bathroom,Plumbing - Toilets - Secure Toilet,Remove and re-install toilet. Include new wax ring installation.,0,1,Y
Bathroom,Plumbing - Toilets - Secure Toilet,Repair tank to toilet bowl connection where leaking or possible leak. ,0,1,Y
Bathroom,Plumbing - Toilets - Secure Toilet,Secure loose tank to toilet bowl connection. Replace any gaskets as needed.,0,1,Y
